{
  "card_id": "20261013T1920Z-promote-ls1",
  "kind": "gate",
  "lesson": "Hedged 'likely to' needs a definite future outcome, not a tendency",
  "target": "Predictive",
  "smoke": false,
  "configs": {
    "baseline": {
      "config16": "f0b5d66f0b36f8e5",
      "rubric_version": "2026-10-13.1",
      "rubric_hash": "sha256:63f085c84a038df8",
      "scope_hash": "sha256:5cf30ca98835c948"
    },
    "candidate": {
      "config16": "2165827e059e280c",
      "rubric_version": "2026-10-13.2",
      "rubric_hash": "sha256:1e4f120596ed29e5",
      "scope_hash": "sha256:5cf30ca98835c948"
    }
  },
  "not_run": [
    {
      "case_id": "ctr-e8a662736d93-source",
      "tag": "Source inaccessible",
      "reason": "source-reading tag: the MVP fetches no source text, so the case is not run",
      "lesson": false
    },
    {
      "case_id": "ctr-c9915a9655ec-improp",
      "tag": "Improperly sourced",
      "reason": "source-reading tag: the MVP fetches no source text, so the case is not run",
      "lesson": false
    },
    {
      "case_id": "ctr-c9915a9655ec-source",
      "tag": "Source inaccessible",
      "reason": "source-reading tag: the MVP fetches no source text, so the case is not run",
      "lesson": false
    },
    {
      "case_id": "ctr-d3da1932b5b8-improp",
      "tag": "Improperly sourced",
      "reason": "source-reading tag: the MVP fetches no source text, so the case is not run",
      "lesson": false
    },
    {
      "case_id": "ctr-d3da1932b5b8-source",
      "tag": "Source inaccessible",
      "reason": "source-reading tag: the MVP fetches no source text, so the case is not run",
      "lesson": false
    },
    {
      "case_id": "ctr-e1af71ee4f64-improp",
      "tag": "Improperly sourced",
      "reason": "source-reading tag: the MVP fetches no source text, so the case is not run",
      "lesson": false
    },
    {
      "case_id": "ctr-e1af71ee4f64-source",
      "tag": "Source inaccessible",
      "reason": "source-reading tag: the MVP fetches no source text, so the case is not run",
      "lesson": false
    },
    {
      "case_id": "ctr-df984286978a-improp",
      "tag": "Improperly sourced",
      "reason": "source-reading tag: the MVP fetches no source text, so the case is not run",
      "lesson": false
    },
    {
      "case_id": "ctr-df984286978a-source",
      "tag": "Source inaccessible",
      "reason": "source-reading tag: the MVP fetches no source text, so the case is not run",
      "lesson": false
    }
  ],
  "rollback": {
    "command": "/claim-tagger promote --rollback Hedged 'likely to' needs a definite future outcome, not a tendency"
  },
  "stats": {
    "method": "paired percentile bootstrap over the labelled claims of a tag (seeded); exact two-sided McNemar test",
    "B": 1000,
    "seed": "h16(baseline + candidate + tag), the 16 hex digits of each config id",
    "ci": [
      0.025,
      0.975
    ],
    "min_positives": 5,
    "tolerance": 0.05,
    "runs": 3
  },
  "cost": {
    "usd": 2.366518,
    "baseline_usd": 0,
    "candidate_usd": 2.366518,
    "model": "claude-sonnet-5-5"
  },
  "verdict": "FAIL",
  "small_sample": true,
  "conditions": [
    {
      "n": 1,
      "status": "pass",
      "detail": "every active canary passes under the candidate: 83 of 83 pass"
    },
    {
      "n": 2,
      "status": "fail",
      "detail": "no active case that passes under the baseline fails under the candidate: 2 of 29 newly failing (ctr-e05138dd8e72-hypoth, ctr-dacb1fb93fb3-hypoth); 24 pass under the baseline"
    },
    {
      "n": 3,
      "status": "fail",
      "detail": "every gated tag keeps its paired accuracy lower bound within the tolerance; ungated tags with changed rules have no negative flips: 2 gated tag(s), lowest lower bound -45.5 points (Hypothetical), tolerance -5.0; 0 ungated tag(s) with changed rules, 0 negative flip(s)"
    },
    {
      "n": 4,
      "status": "hold",
      "detail": "the target tag's interval is above zero: Predictive interval 0.0 to +54.5 points straddles zero"
    },
    {
      "n": 5,
      "status": "pass",
      "detail": "no apply on a tag the candidate does not judge, or on a human-only tag: none"
    }
  ],
  "holds": [
    "Predictive: interval straddles zero (0.0 to +54.5 points); more labels needed"
  ],
  "reasons": [
    "2 regression cases newly failing: ctr-e05138dd8e72-hypoth, ctr-dacb1fb93fb3-hypoth",
    "Hypothetical: accuracy lower bound -45.5 points (tolerance -5.0)"
  ],
  "not_gated": [
    "Context-dependent (4 positives of 11)"
  ],
  "canaries": {
    "baseline": {
      "active": 83,
      "passed": 83,
      "failing": []
    },
    "candidate": {
      "active": 83,
      "passed": 83,
      "failing": []
    }
  },
  "cases": {
    "gating": [
      "ctr-c90a07a26900-contex",
      "ctr-c2863d198c3b-hypoth",
      "ctr-d42aa33076b4-predic",
      "ctr-f77c821bc698-contex",
      "ctr-ea4fbb86cc01-hypoth",
      "ctr-d56ecb14613e-contex",
      "ctr-d91f85d0dae4-hypoth",
      "ctr-d71a4fe9990a-hypoth",
      "ctr-ec6e3f00cf08-contex",
      "ctr-f796423c788b-contex",
      "ctr-f804e2a1c094-contex",
      "ctr-d8a3944540b5-contex",
      "ctr-c88518ef32ac-contex",
      "ctr-d4408cbe2b96-hypoth",
      "ctr-c9796d976bfb-predic",
      "ctr-e05138dd8e72-hypoth",
      "ctr-fc4df1264d12-hypoth",
      "ctr-c3a726790afd-predic",
      "ctr-d2cc4e9e1679-predic",
      "ctr-ceacdc6c95a9-contex",
      "ctr-c59c5313859e-contex",
      "ctr-ef04483dc87e-hypoth",
      "ctr-e051f47f69ff-hypoth",
      "ctr-d21451c346f9-hypoth",
      "ctr-d8f24707806b-predic",
      "ctr-dacb1fb93fb3-hypoth",
      "ctr-e25cad5cf816-contex",
      "ctr-e4fed14cbb0d-predic",
      "ctr-f2cc9025f0f5-predic"
    ],
    "passing_baseline": 24,
    "passing_candidate": 22,
    "newly_failing": [
      "ctr-e05138dd8e72-hypoth",
      "ctr-dacb1fb93fb3-hypoth"
    ],
    "newly_passing": [],
    "rule_changed": [
      "ctr-d42aa33076b4-predic",
      "ctr-c9796d976bfb-predic",
      "ctr-c3a726790afd-predic",
      "ctr-d2cc4e9e1679-predic",
      "ctr-d8f24707806b-predic",
      "ctr-e4fed14cbb0d-predic",
      "ctr-f2cc9025f0f5-predic",
      "ctr-c968f9819580-predic",
      "ctr-c78bac8861c7-predic",
      "ctr-c7c20ae98de9-predic",
      "ctr-c9b46cfbd720-predic"
    ],
    "lesson": {
      "key": "Hedged 'likely to' needs a definite future outcome, not a tendency",
      "cases": [
        "ctr-c968f9819580-predic",
        "ctr-c78bac8861c7-predic",
        "ctr-c7c20ae98de9-predic",
        "ctr-c9b46cfbd720-predic"
      ],
      "fixed": [
        "ctr-c78bac8861c7-predic",
        "ctr-c7c20ae98de9-predic",
        "ctr-c9b46cfbd720-predic"
      ],
      "broken": []
    },
    "items": [
      {
        "case_id": "ctr-c90a07a26900-contex",
        "tag": "Context-dependent",
        "expected": "do_not_apply",
        "baseline": "do_not_apply",
        "candidate": "do_not_apply"
      },
      {
        "case_id": "ctr-c2863d198c3b-hypoth",
        "tag": "Hypothetical",
        "expected": "apply",
        "baseline": "apply",
        "candidate": "apply"
      },
      {
        "case_id": "ctr-d42aa33076b4-predic",
        "tag": "Predictive",
        "expected": "apply",
        "baseline": "apply",
        "candidate": "apply",
        "rule_changed": true
      },
      {
        "case_id": "ctr-f77c821bc698-contex",
        "tag": "Context-dependent",
        "expected": "do_not_apply",
        "baseline": "do_not_apply",
        "candidate": "do_not_apply"
      },
      {
        "case_id": "ctr-ea4fbb86cc01-hypoth",
        "tag": "Hypothetical",
        "expected": "apply",
        "baseline": "apply",
        "candidate": "apply"
      },
      {
        "case_id": "ctr-d56ecb14613e-contex",
        "tag": "Context-dependent",
        "expected": "apply",
        "baseline": "apply",
        "candidate": "apply"
      },
      {
        "case_id": "ctr-d91f85d0dae4-hypoth",
        "tag": "Hypothetical",
        "expected": "apply",
        "baseline": "apply",
        "candidate": "apply"
      },
      {
        "case_id": "ctr-d71a4fe9990a-hypoth",
        "tag": "Hypothetical",
        "expected": "apply",
        "baseline": "apply",
        "candidate": "apply"
      },
      {
        "case_id": "ctr-ec6e3f00cf08-contex",
        "tag": "Context-dependent",
        "expected": "apply",
        "baseline": "apply",
        "candidate": "apply"
      },
      {
        "case_id": "ctr-f796423c788b-contex",
        "tag": "Context-dependent",
        "expected": "do_not_apply",
        "baseline": "do_not_apply",
        "candidate": "do_not_apply"
      },
      {
        "case_id": "ctr-f804e2a1c094-contex",
        "tag": "Context-dependent",
        "expected": "do_not_apply",
        "baseline": "do_not_apply",
        "candidate": "do_not_apply"
      },
      {
        "case_id": "ctr-d8a3944540b5-contex",
        "tag": "Context-dependent",
        "expected": "apply",
        "baseline": "apply",
        "candidate": "apply"
      },
      {
        "case_id": "ctr-c88518ef32ac-contex",
        "tag": "Context-dependent",
        "expected": "do_not_apply",
        "baseline": "apply",
        "candidate": "apply"
      },
      {
        "case_id": "ctr-d4408cbe2b96-hypoth",
        "tag": "Hypothetical",
        "expected": "apply",
        "baseline": "apply",
        "candidate": "apply"
      },
      {
        "case_id": "ctr-c9796d976bfb-predic",
        "tag": "Predictive",
        "expected": "apply",
        "baseline": "apply",
        "candidate": "apply",
        "rule_changed": true
      },
      {
        "case_id": "ctr-e05138dd8e72-hypoth",
        "tag": "Hypothetical",
        "expected": "apply",
        "baseline": "apply",
        "candidate": "ask_editor"
      },
      {
        "case_id": "ctr-fc4df1264d12-hypoth",
        "tag": "Hypothetical",
        "expected": "apply",
        "baseline": "apply",
        "candidate": "apply"
      },